{
  "schemaVersion": 1,
  "type": "ruleProfile",
  "id": "legacy.captivity-sfw:rule/captivity-no-rape",
  "displayName": "Captivity No Rape",
  "description": "The legacy CNR rules: enemies cannot start finishers or tear clothing, zero health consumes a heart instead, and player health/stamina capacity is tripled.",
  "modules": [
    {
      "type": "playerRules",
      "enemyFinishersEnabled": false,
      "clothingDamageEnabled": false,
      "safeKnockouts": true,
      "playerHealthMultiplier": 3.0
    }
  ]
}
